"mdl_url","title_en","title_zh","genres","Action","Adventure","Business","Comedy","Crime","Documentary","Drama","Family","Fantasy","Food","Historical","Horror","Law","Life","Martial Arts","Medical","Melodrama","Military","Music","Mystery","Political","Psychological","Romance","Sci-Fi","Sitcom","Sports","Supernatural","Thriller","Tokusatsu","War","Wuxia","Youth"
"/9025-nirvana-in-fire","Nirvana in Fire","琅琊榜","Military, Historical, Drama, Political",0,0,0,0,0,0,1,0,0,0,1,0,0,0,0,0,0,1,0,0,1,0,0,0,0,0,0,0,0,0,0,0
"/697563-kai-duan","Reset","开端","Thriller, Mystery, Sci-Fi",0,0,0,0,0,0,0,0,0,0,0,0,0,0,0,0,0,0,0,1,0,0,0,1,0,0,0,1,0,0,0,0
"/28674-joy-of-life","Joy of Life","庆余年","Mystery, Romance, Wuxia, Fantasy",0,0,0,0,0,0,0,0,1,0,0,0,0,0,0,0,0,0,0,1,0,0,1,0,0,0,0,0,0,0,1,0
"/28723-the-untamed","The Untamed","陈情令","Mystery, Wuxia, Fantasy",0,0,0,0,0,0,0,0,1,0,0,0,0,0,0,0,0,0,0,1,0,0,0,0,0,0,0,0,0,0,1,0
"/729363-love-like-the-galaxy-part-2","Love Like the Galaxy: Part 2","月升沧海","Historical, Mystery, Romance, Political",0,0,0,0,0,0,0,0,0,0,1,0,0,0,0,0,0,0,0,1,1,0,1,0,0,0,0,0,0,0,0,0
"/687167-xing-han-can-lan","Love Like the Galaxy: Part 1","星汉灿烂","Historical, Mystery, Romance, Political",0,0,0,0,0,0,0,0,0,0,1,0,0,0,0,0,0,0,0,1,1,0,1,0,0,0,0,0,0,0,0,0
"/40911-go-ahead","Go Ahead","以家人之名","Comedy, Romance, Drama, Melodrama",0,0,0,1,0,0,1,0,0,0,0,0,0,0,0,0,1,0,0,0,0,0,1,0,0,0,0,0,0,0,0,0
"/23911-the-story-of-ming-lan","The Story of Ming Lan","知否知否应是绿肥红瘦","Historical, Romance, Life, Drama",0,0,0,0,0,0,1,0,0,0,1,0,0,1,0,0,0,0,0,0,0,0,1,0,0,0,0,0,0,0,0,0
"/53117-cang-lan-jue","Love Between Fairy and Devil","苍兰诀","Comedy, Romance, Wuxia, Fantasy",0,0,0,1,0,0,0,0,1,0,0,0,0,0,0,0,0,0,0,0,0,0,1,0,0,0,0,0,0,0,1,0
"/683119-shao-nian-ge-xing","The Blood of Youth","少年歌行","Wuxia, Youth, Fantasy",0,0,0,0,0,0,0,0,1,0,0,0,0,0,0,0,0,0,0,0,0,0,0,0,0,0,0,0,0,0,1,1
"/45437-qi-hun","Hikaru no Go","棋魂","Comedy, Drama, Sports, Supernatural",0,0,0,1,0,0,1,0,0,0,0,0,0,0,0,0,0,0,0,0,0,0,0,0,0,1,1,0,0,0,0,0
"/16547-eternal-love","Eternal Love","三生三世十里桃花","Romance, Wuxia, Drama, Fantasy",0,0,0,0,0,0,1,0,1,0,0,0,0,0,0,0,0,0,0,0,0,0,1,0,0,0,0,0,0,0,1,0
"/28565-the-tale-of-yanxi-palace","Story of Yanxi Palace","延禧攻略","Historical, Romance, Drama",0,0,0,0,0,0,1,0,0,0,1,0,0,0,0,0,0,0,0,0,0,0,1,0,0,0,0,0,0,0,0,0
"/62337-you-are-my-glory","You Are My Glory","你是我的荣耀","Comedy, Romance, Life, Drama",0,0,0,1,0,0,1,0,0,0,0,0,0,1,0,0,0,0,0,0,0,0,1,0,0,0,0,0,0,0,0,0
"/39661-love-and-redemption","Love and Redemption","琉璃","Romance, Wuxia, Drama, Fantasy",0,0,0,0,0,0,1,0,1,0,0,0,0,0,0,0,0,0,0,0,0,0,1,0,0,0,0,0,0,0,1,0
"/59487-sword-snow-stride","Sword Snow Stride","雪中悍刀行","Wuxia, Drama, Fantasy, Melodrama",0,0,0,0,0,0,1,0,1,0,0,0,0,0,0,0,1,0,0,0,0,0,0,0,0,0,0,0,0,0,1,0
"/68429-the-lighter-and-the-princess-gown","Lighter & Princess","点燃我，温暖你","Business, Romance, Youth, Drama",0,0,1,0,0,0,1,0,0,0,0,0,0,0,0,0,0,0,0,0,0,0,1,0,0,0,0,0,0,0,0,1
"/63781-love-your-bones-forever-2","One and Only","周生如故","Military, Romance, Wuxia, Political",0,0,0,0,0,0,0,0,0,0,0,0,0,0,0,0,0,1,0,0,1,0,1,0,0,0,0,0,0,0,1,0
"/53953-princess-changge","The Long Ballad","长歌行","Action, Historical, Romance, War",1,0,0,0,0,0,0,0,0,0,1,0,0,0,0,0,0,0,0,0,0,0,1,0,0,0,0,0,0,1,0,0
"/70249-lie-zui-tu-jian","Under the Skin","猎罪图鉴","Thriller, Mystery",0,0,0,0,0,0,0,0,0,0,0,0,0,0,0,0,0,0,0,1,0,0,0,0,0,0,0,1,0,0,0,0
"/54851-try-the-world","Who Rules the World","且试天下","Romance, Wuxia, Fantasy",0,0,0,0,0,0,0,0,1,0,0,0,0,0,0,0,0,0,0,0,0,0,1,0,0,0,0,0,0,0,1,0
"/700341-qing-chuan-daily-life","New Life Begins","卿卿日常","Historical, Comedy, Romance, Life",0,0,0,1,0,0,0,0,0,0,1,0,0,1,0,0,0,0,0,0,0,0,1,0,0,0,0,0,0,0,0,0
"/20566-nirvana-in-fire-2-the-wind-blows-in-chang-lin","Nirvana in Fire Season 2: The Wind Blows in Chang Lin","琅琊榜之风起长林","Military, Wuxia, Drama, Political",0,0,0,0,0,0,1,0,0,0,0,0,0,0,0,0,0,1,0,0,1,0,0,0,0,0,0,0,0,0,1,0
"/51397-final-chronicles","Ultimate Note","终极笔记","Action, Adventure, Thriller, Mystery",1,1,0,0,0,0,0,0,0,0,0,0,0,0,0,0,0,0,0,1,0,0,0,0,0,0,0,1,0,0,0,0
"/49241-falling-into-your-smile","Falling Into Your Smile","你微笑时很美","Comedy, Romance, Youth, Sports",0,0,0,1,0,0,0,0,0,0,0,0,0,0,0,0,0,0,0,0,0,0,1,0,0,1,0,0,0,0,0,1
"/49877-love-to-be-loved-by-you","You Are My Hero","你是我的城池营垒","Military, Romance, Drama, Medical",0,0,0,0,0,0,1,0,0,0,0,0,0,0,0,1,0,1,0,0,0,0,1,0,0,0,0,0,0,0,0,0
"/31618-winter-begonia","Winter Begonia","鬓边不是海棠红","Historical, Business, Romance, Drama",0,0,1,0,0,0,1,0,0,0,1,0,0,0,0,0,0,0,0,0,0,0,1,0,0,0,0,0,0,0,0,0
"/5591-battle-of-changsha","Battle of Changsha","战长沙","Military, Historical, Romance, War",0,0,0,0,0,0,0,0,0,0,1,0,0,0,0,0,0,1,0,0,0,0,1,0,0,0,0,0,0,1,0,0
"/51571-cat-s-cradle","The Bad Kids","隐秘的角落","Adventure, Thriller, Mystery",0,1,0,0,0,0,0,0,0,0,0,0,0,0,0,0,0,0,0,1,0,0,0,0,0,0,0,1,0,0,0,0
"/26385-three-lives-three-worlds-the-pillow-book","Eternal Love of Dream","三生三世枕上书","Romance, Wuxia, Drama, Fantasy",0,0,0,0,0,0,1,0,1,0,0,0,0,0,0,0,0,0,0,0,0,0,1,0,0,0,0,0,0,0,1,0
"/23281-heavy-sweetness-ash-like-frost","Ashes of Love","香蜜沉沉烬如霜","Romance, Wuxia, Drama, Fantasy",0,0,0,0,0,0,1,0,1,0,0,0,0,0,0,0,0,0,0,0,0,0,1,0,0,0,0,0,0,0,1,0
"/59327-the-legend-of-gu-and-jue","Ancient Love Poetry","千古玦尘","Romance, Wuxia, Drama, Fantasy",0,0,0,0,0,0,1,0,1,0,0,0,0,0,0,0,0,0,0,0,0,0,1,0,0,0,0,0,0,0,1,0
"/38907-the-third-princess-from-the-rumors","The Romance of Tiger and Rose","传闻中的陈芊芊","Historical, Comedy, Romance, Fantasy",0,0,0,1,0,0,0,0,1,0,1,0,0,0,0,0,0,0,0,0,0,0,1,0,0,0,0,0,0,0,0,0
"/30867-special-forces","Glory of Special Forces","特战荣耀","Action, Military, Youth, Drama",1,0,0,0,0,0,1,0,0,0,0,0,0,0,0,0,0,1,0,0,0,0,0,0,0,0,0,0,0,0,0,1
"/52897-lovely-us","Lovely Us","如此可爱的我们","Comedy, Romance, Life, Youth",0,0,0,1,0,0,0,0,0,0,0,0,0,1,0,0,0,0,0,0,0,0,1,0,0,0,0,0,0,0,0,1
"/33767-crossfire","Cross Fire","穿越火线","Action, Youth, Sci-Fi, Sports",1,0,0,0,0,0,0,0,0,0,0,0,0,0,0,0,0,0,0,0,0,0,0,1,0,1,0,0,0,0,0,1
"/59021-tian-ya-ke","Word of Honor","山河令","Mystery, Wuxia, Fantasy, Political",0,0,0,0,0,0,0,0,1,0,0,0,0,0,0,0,0,0,0,1,1,0,0,0,0,0,0,0,0,0,1,0
"/76433-secrets-in-the-lattice","Our Secret","暗格里的秘密","Romance, Life, Youth",0,0,0,0,0,0,0,0,0,0,0,0,0,1,0,0,0,0,0,0,0,0,1,0,0,0,0,0,0,0,0,1
"/50395-forever-love","Forever Love","百岁之好，一言为定","Comedy, Romance, Youth, Drama",0,0,0,1,0,0,1,0,0,0,0,0,0,0,0,0,0,0,0,0,0,0,1,0,0,0,0,0,0,0,0,1
"/67269-the-moment-of-meeting-again","Shining for One Thing","一闪一闪亮星星","Mystery, Romance, Youth, Fantasy",0,0,0,0,0,0,0,0,1,0,0,0,0,0,0,0,0,0,0,1,0,0,1,0,0,0,0,0,0,0,0,1
"/24018-the-kings-avatar","The King’s Avatar","全职高手","Action, Youth, Sports",1,0,0,0,0,0,0,0,0,0,0,0,0,0,0,0,0,0,0,0,0,0,0,0,0,1,0,0,0,0,0,1
"/54335-my-small-indeed-fortunate","My Little Happiness","我的小确幸","Comedy, Law, Romance, Drama",0,0,0,1,0,0,1,0,0,0,0,0,1,0,0,0,0,0,0,0,0,0,1,0,0,0,0,0,0,0,0,0
"/30919-arsenal-military-academy","Arsenal Military Academy","烈火军校","Action, Military, Historical, Romance",1,0,0,0,0,0,0,0,0,0,1,0,0,0,0,0,0,1,0,0,0,0,1,0,0,0,0,0,0,0,0,0
"/687517-wo-zai-ta-xiang-ting-hao-de","Remembrance of Things Past","我在他乡挺好的","Romance, Life, Drama",0,0,0,0,0,0,1,0,0,0,0,0,0,1,0,0,0,0,0,0,0,0,1,0,0,0,0,0,0,0,0,0
"/27234-le-coup-de-foudre","Le Coup de Foudre","我只喜欢你","Comedy, Romance, Life, Youth",0,0,0,1,0,0,0,0,0,0,0,0,0,1,0,0,0,0,0,0,0,0,1,0,0,0,0,0,0,0,0,1
"/66743-the-day-of-becoming-you","The Day of Becoming You","变成你的那一天","Comedy, Romance, Supernatural",0,0,0,1,0,0,0,0,0,0,0,0,0,0,0,0,0,0,0,0,0,0,1,0,0,0,1,0,0,0,0,0
"/26035-guardian","Guardian","镇魂","Thriller, Mystery, Fantasy",0,0,0,0,0,0,0,0,1,0,0,0,0,0,0,0,0,0,0,1,0,0,0,0,0,0,0,1,0,0,0,0
"/27467-go-go-squid","Go Go Squid!","亲爱的，热爱的","Comedy, Romance, Youth, Sports",0,0,0,1,0,0,0,0,0,0,0,0,0,0,0,0,0,0,0,0,0,0,1,0,0,1,0,0,0,0,0,1
"/70645-reunion-the-sound-of-the-providence-season-2","Reunion: The Sound of the Providence Season 2","重啟之極海聽雷第二季","Adventure, Thriller, Mystery, Fantasy",0,1,0,0,0,0,0,0,1,0,0,0,0,0,0,0,0,0,0,1,0,0,0,0,0,0,0,1,0,0,0,0
"/31194-the-prince-of-tennis","The Prince of Tennis","奋斗吧，少年！","Youth, Drama, Sports",0,0,0,0,0,0,1,0,0,0,0,0,0,0,0,0,0,0,0,0,0,0,0,0,0,1,0,0,0,0,0,1
"/49871-love-is-sweet","Love Is Sweet","半是蜜糖半是伤","Business, Comedy, Romance",0,0,1,1,0,0,0,0,0,0,0,0,0,0,0,0,0,0,0,0,0,0,1,0,0,0,0,0,0,0,0,0
"/692791-cai-bu-yao-he-lao-ban-tan-lian-ai","Legally Romance","才不要和老板谈恋爱","Comedy, Law, Romance, Fantasy",0,0,0,1,0,0,0,0,1,0,0,0,1,0,0,0,0,0,0,0,0,0,1,0,0,0,0,0,0,0,0,0
"/49485-the-long-night","The Long Night","沉默的真相","Thriller, Mystery, Drama",0,0,0,0,0,0,1,0,0,0,0,0,0,0,0,0,0,0,0,1,0,0,0,0,0,0,0,1,0,0,0,0
"/28435-the-longest-day-in-chang-an","The Longest Day in Chang'an","长安十二时辰","Action, Thriller, Historical, Political",1,0,0,0,0,0,0,0,0,0,1,0,0,0,0,0,0,0,0,0,1,0,0,0,0,0,0,1,0,0,0,0
"/70237-accompany-you-to-fly-by-the-wind","To Fly With You","陪你逐风飞翔","Comedy, Romance, Youth, Sports",0,0,0,1,0,0,0,0,0,0,0,0,0,0,0,0,0,0,0,0,0,0,1,0,0,1,0,0,0,0,0,1
"/4474-legend-of-concubine-zhen-huan","Legend of Concubine Zhen Huan","後宮甄嬛傳","Historical, Drama, Melodrama, Political",0,0,0,0,0,0,1,0,0,0,1,0,0,0,0,0,1,0,0,0,1,0,0,0,0,0,0,0,0,0,0,0
"/33779-hen-jun-bu-si-jiang-lou-yue","Killer And Healer","恨君不似江楼月","Thriller, Historical, Mystery, Crime",0,0,0,0,1,0,0,0,0,0,1,0,0,0,0,0,0,0,0,1,0,0,0,0,0,0,0,1,0,0,0,0
"/50135-the-imperial-coroner","The Imperial Coroner","御赐小仵作","Historical, Mystery, Romance, Medical",0,0,0,0,0,0,0,0,0,0,1,0,0,0,0,1,0,0,0,1,0,0,1,0,0,0,0,0,0,0,0,0
"/33272-the-story-of-ming-dynasty","The Sleuth of Ming Dynasty","成化十四年","Historical, Mystery, Drama",0,0,0,0,0,0,1,0,0,0,1,0,0,0,0,0,0,0,0,1,0,0,0,0,0,0,0,0,0,0,0,0
"/76169-bian-liang-meng-hua-tu","A Dream of Splendor","梦华录","Historical, Romance",0,0,0,0,0,0,0,0,0,0,1,0,0,0,0,0,0,0,0,0,0,0,1,0,0,0,0,0,0,0,0,0
"/25650-beneath-the-embroidered-uniform","Under the Power","锦衣之下","Mystery, Comedy, Romance, Wuxia",0,0,0,1,0,0,0,0,0,0,0,0,0,0,0,0,0,0,0,1,0,0,1,0,0,0,0,0,0,0,1,0
"/706623-shi-guang-yu-ta-qia-shi-zheng-hao","Time and Him Are Just Right","时光与他，恰是正好","Romance, Youth",0,0,0,0,0,0,0,0,0,0,0,0,0,0,0,0,0,0,0,0,0,0,1,0,0,0,0,0,0,0,0,1
"/61865-love-your-bones-forever","Forever and Ever","一生一世","Romance, Drama",0,0,0,0,0,0,1,0,0,0,0,0,0,0,0,0,0,0,0,0,0,0,1,0,0,0,0,0,0,0,0,0
"/688563-the-blue-whisper-part-2","The Blue Whisper: Part 2","恰似故人归","Romance, Wuxia, Fantasy",0,0,0,0,0,0,0,0,1,0,0,0,0,0,0,0,0,0,0,0,0,0,1,0,0,0,0,0,0,0,1,0
"/21032-the-rise-of-phoenixes","The Rise of Phoenixes","天盛长歌","Historical, Romance, Melodrama, Political",0,0,0,0,0,0,0,0,0,0,1,0,0,0,0,0,1,0,0,0,1,0,1,0,0,0,0,0,0,0,0,0
"/37243-a-murderous-affair-in-horizon-tower","A Murderous Affair in Horizon Tower","摩天大楼","Thriller, Mystery, Drama",0,0,0,0,0,0,1,0,0,0,0,0,0,0,0,0,0,0,0,1,0,0,0,0,0,0,0,1,0,0,0,0
"/27178-ever-night","Ever Night","将夜","Romance, Wuxia, Drama, Fantasy",0,0,0,0,0,0,1,0,1,0,0,0,0,0,0,0,0,0,0,0,0,0,1,0,0,0,0,0,0,0,1,0
"/34030-skate-into-love","Skate Into Love","冰糖炖雪梨","Comedy, Romance, Youth, Sports",0,0,0,1,0,0,0,0,0,0,0,0,0,0,0,0,0,0,0,0,0,0,1,0,0,1,0,0,0,0,0,1
"/59749-goodbye-my-princess-director-s-cut","Goodbye My Princess: Director's Cut","东宫","Historical, Romance, Drama, Political",0,0,0,0,0,0,1,0,0,0,1,0,0,0,0,0,0,0,0,0,1,0,1,0,0,0,0,0,0,0,0,0
"/63959-sweet-teeth","Sweet Teeth","世界微尘里","Comedy, Romance, Drama, Medical",0,0,0,1,0,0,1,0,0,0,0,0,0,0,0,1,0,0,0,0,0,0,1,0,0,0,0,0,0,0,0,0
"/686115-chi-dao","Falling Into You","炽道","Romance, Drama, Sports",0,0,0,0,0,0,1,0,0,0,0,0,0,0,0,0,0,0,0,0,0,0,1,0,0,1,0,0,0,0,0,0
"/53549-fall-in-love","Fall In Love","一见倾心","Historical, Mystery, Romance, Political",0,0,0,0,0,0,0,0,0,0,1,0,0,0,0,0,0,0,0,1,1,0,1,0,0,0,0,0,0,0,0,0
"/61969-qiao-jia-de-er-nu","The Bond","乔家的儿女","Life, Drama",0,0,0,0,0,0,1,0,0,0,0,0,0,1,0,0,0,0,0,0,0,0,0,0,0,0,0,0,0,0,0,0
"/28037-emperor-phoenix","The Rebel Princess","上阳赋","Historical, Romance, Drama, Melodrama",0,0,0,0,0,0,1,0,0,0,1,0,0,0,0,0,1,0,0,0,0,0,1,0,0,0,0,0,0,0,0,0
"/31385-put-your-head-on-my-shoulder","Put Your Head on My Shoulder","致我们暖暖的小时光","Comedy, Romance, Life, Youth",0,0,0,1,0,0,0,0,0,0,0,0,0,1,0,0,0,0,0,0,0,0,1,0,0,0,0,0,0,0,0,1
"/64085-yu-jiao-ji","The Blue Whisper: Part 1","与君初相识","Romance, Wuxia, Fantasy",0,0,0,0,0,0,0,0,1,0,0,0,0,0,0,0,0,0,0,0,0,0,1,0,0,0,0,0,0,0,1,0
"/52895-love-scenery","Love Scenery","良辰美景好时光","Music, Comedy, Romance",0,0,0,1,0,0,0,0,0,0,0,0,0,0,0,0,0,0,1,0,0,0,1,0,0,0,0,0,0,0,0,0
"/72025-chen-xiang-ru-xie","Immortal Samsara: Part 1","沉香如屑","Romance, Wuxia, Drama, Fantasy",0,0,0,0,0,0,1,0,1,0,0,0,0,0,0,0,0,0,0,0,0,0,1,0,0,0,0,0,0,0,1,0
"/33701-douluo-continent","Douluo Continent","斗罗大陆","Comedy, Romance, Wuxia, Fantasy",0,0,0,1,0,0,0,0,1,0,0,0,0,0,0,0,0,0,0,0,0,0,1,0,0,0,0,0,0,0,1,0
"/63989-crush","Crush","原来我很爱你","Romance, Life, Youth, Drama",0,0,0,0,0,0,1,0,0,0,0,0,0,1,0,0,0,0,0,0,0,0,1,0,0,0,0,0,0,0,0,1
"/710595-hi-venus","Hi Venus","我可能遇到了救星","Comedy, Romance, Life, Medical",0,0,0,1,0,0,0,0,0,0,0,0,0,1,0,1,0,0,0,0,0,0,1,0,0,0,0,0,0,0,0,0
"/34129-my-roommate-is-a-detective","My Roommate Is a Detective","民国奇探","Thriller, Historical, Mystery, Comedy",0,0,0,1,0,0,0,0,0,0,1,0,0,0,0,0,0,0,0,1,0,0,0,0,0,0,0,1,0,0,0,0
"/20284-medical-examiner-dr.-qin","Medical Examiner Dr. Qin","法医秦明","Mystery, Drama, Medical",0,0,0,0,0,0,1,0,0,0,0,0,0,0,0,1,0,0,0,1,0,0,0,0,0,0,0,0,0,0,0,0
"/29240-the-fate-of-chen-xi","Love and Destiny","宸汐缘","Romance, Wuxia, Drama, Fantasy",0,0,0,0,0,0,1,0,1,0,0,0,0,0,0,0,0,0,0,0,0,0,1,0,0,0,0,0,0,0,1,0
"/66371-unforgettable-love","Unforgettable Love","贺先生的恋恋不忘","Comedy, Romance, Drama",0,0,0,1,0,0,1,0,0,0,0,0,0,0,0,0,0,0,0,0,0,0,1,0,0,0,0,0,0,0,0,0
"/26895-ren-bu-biao-han-wang-shao-nian","When We Were Young","人不彪悍枉少年","Romance, Life, Youth",0,0,0,0,0,0,0,0,0,0,0,0,0,1,0,0,0,0,0,0,0,0,1,0,0,0,0,0,0,0,0,1
"/51565-a-river-runs-through-it","A River Runs Through It","上游","Comedy, Romance, Life, Youth",0,0,0,1,0,0,0,0,0,0,0,0,0,1,0,0,0,0,0,0,0,0,1,0,0,0,0,0,0,0,0,1
"/23171-legend-of-fu-yao","Legend of Fu Yao","扶摇","Romance, Wuxia, Fantasy",0,0,0,0,0,0,0,0,1,0,0,0,0,0,0,0,0,0,0,0,0,0,1,0,0,0,0,0,0,0,1,0
"/66455-moonlight","Moonlight","月光变奏曲","Business, Comedy, Romance, Drama",0,0,1,1,0,0,1,0,0,0,0,0,0,0,0,0,0,0,0,0,0,0,1,0,0,0,0,0,0,0,0,0
"/13857-love-me-if-you-dare","Love Me If You Dare","他来了, 请闭眼","Thriller, Mystery, Psychological, Romance",0,0,0,0,0,0,0,0,0,0,0,0,0,0,0,0,0,0,0,1,0,1,1,0,0,0,0,1,0,0,0,0
"/40353-maiden-holmes","Maiden Holmes","少女大人","Historical, Mystery, Comedy, Romance",0,0,0,1,0,0,0,0,0,0,1,0,0,0,0,0,0,0,0,1,0,0,1,0,0,0,0,0,0,0,0,0
"/15338-the-princess-wei-young","The Princess Wei Young","锦绣未央","Historical, Romance, Drama, Political",0,0,0,0,0,0,1,0,0,0,1,0,0,0,0,0,0,0,0,0,1,0,1,0,0,0,0,0,0,0,0,0
"/685039-my-calorie-boy","My Calorie Boy","我的卡路里男孩","Comedy, Romance, Youth",0,0,0,1,0,0,0,0,0,0,0,0,0,0,0,0,0,0,0,0,0,0,1,0,0,0,0,0,0,0,0,1
"/38807-yu-sheng-qing-duo-zhi-jiao","The Oath of Love","余生，请多指教","Romance, Life, Youth, Drama",0,0,0,0,0,0,1,0,0,0,0,0,0,1,0,0,0,0,0,0,0,0,1,0,0,0,0,0,0,0,0,1
"/733265-immortal-samsara-part-2","Immortal Samsara: Part 2","沉香重华","Romance, Wuxia, Drama, Fantasy",0,0,0,0,0,0,1,0,1,0,0,0,0,0,0,0,0,0,0,0,0,0,1,0,0,0,0,0,0,0,1,0
"/69073-love-me-like-a-child","My Fated Boy","我的邻居长不大","Comedy, Romance, Life",0,0,0,1,0,0,0,0,0,0,0,0,0,1,0,0,0,0,0,0,0,0,1,0,0,0,0,0,0,0,0,0
"/18756-ruyis-royal-love-in-the-palace","Ruyi's Royal Love in the Palace","如懿传","Historical, Romance, Drama, Melodrama",0,0,0,0,0,0,1,0,0,0,1,0,0,0,0,0,1,0,0,0,0,0,1,0,0,0,0,0,0,0,0,0
"/54889-mr-perfect-and-miss-almost","Perfect and Casual","完美先生和差不多小姐","Comedy, Romance, Drama",0,0,0,1,0,0,1,0,0,0,0,0,0,0,0,0,0,0,0,0,0,0,1,0,0,0,0,0,0,0,0,0
"/32804-my-girlfriend-is-an-alien","My Girlfriend Is an Alien","外星女生柴小七","Comedy, Romance, Fantasy",0,0,0,1,0,0,0,0,1,0,0,0,0,0,0,0,0,0,0,0,0,0,1,0,0,0,0,0,0,0,0,0
"/688445-fei-hu-wai-zhuan","Side Story of Fox Volant","飞狐外传","Wuxia, Drama",0,0,0,0,0,0,1,0,0,0,0,0,0,0,0,0,0,0,0,0,0,0,0,0,0,0,0,0,0,0,1,0
"/61135-don-t-think-of-interrupting-my-studies","Don't Disturb My Study","别想打扰我学习","Comedy, Romance, Life, Youth",0,0,0,1,0,0,0,0,0,0,0,0,0,1,0,0,0,0,0,0,0,0,1,0,0,0,0,0,0,0,0,1
"/24644-a-love-so-beautiful","A Love So Beautiful","致我们单纯的小美好","Comedy, Romance, Life, Youth",0,0,0,1,0,0,0,0,0,0,0,0,0,1,0,0,0,0,0,0,0,0,1,0,0,0,0,0,0,0,0,1
"/65743-alien-girl-chai-xiao-qi-2","My Girlfriend Is an Alien Season 2","外星女生柴小七2","Comedy, Romance, Sci-Fi, Fantasy",0,0,0,1,0,0,0,0,1,0,0,0,0,0,0,0,0,0,0,0,0,0,1,1,0,0,0,0,0,0,0,0
"/15031-love-o2o","Love O2O","微微一笑很倾城","Business, Comedy, Romance, Drama",0,0,1,1,0,0,1,0,0,0,0,0,0,0,0,0,0,0,0,0,0,0,1,0,0,0,0,0,0,0,0,0
"/51651-i-don-t-want-to-be-friends-with-you","I Don't Want to Be Friends With You","我才不要和你做朋友呢","Comedy, Romance, Youth, Fantasy",0,0,0,1,0,0,0,0,1,0,0,0,0,0,0,0,0,0,0,0,0,0,1,0,0,0,0,0,0,0,0,1
"/684207-delicious-romance","Delicious Romance","爱很美味","Romance, Life, Drama",0,0,0,0,0,0,1,0,0,0,0,0,0,1,0,0,0,0,0,0,0,0,1,0,0,0,0,0,0,0,0,0
"/30581-the-lost-tomb-3","Reunion: The Sound of the Providence","重啟之極海聽雷","Adventure, Mystery, Horror, Fantasy",0,1,0,0,0,0,0,0,1,0,0,1,0,0,0,0,0,0,0,1,0,0,0,0,0,0,0,0,0,0,0,0
"/36671-a-little-reunion","A Little Reunion","小欢喜","Life, Youth, Drama",0,0,0,0,0,0,1,0,0,0,0,0,0,1,0,0,0,0,0,0,0,0,0,0,0,0,0,0,0,0,0,1
"/688487-be-reborn","Be Reborn","重生之门","Thriller, Mystery, Crime",0,0,0,0,1,0,0,0,0,0,0,0,0,0,0,0,0,0,0,1,0,0,0,0,0,0,0,1,0,0,0,0
"/61891-jun-jiu-ling","Jun Jiu Ling","君九龄","Historical, Mystery, Romance, Drama",0,0,0,0,0,0,1,0,0,0,1,0,0,0,0,0,0,0,0,1,0,0,1,0,0,0,0,0,0,0,0,0
"/733007-the-evil-face","A Familiar Stranger","虚颜","Historical, Romance, Supernatural",0,0,0,0,0,0,0,0,0,0,1,0,0,0,0,0,0,0,0,0,0,0,1,0,0,0,1,0,0,0,0,0
"/31998-novoland-pearl-eclipse","Novoland: Pearl Eclipse","斛珠夫人","Romance, Wuxia, Fantasy",0,0,0,0,0,0,0,0,1,0,0,0,0,0,0,0,0,0,0,0,0,0,1,0,0,0,0,0,0,0,1,0
"/58945-jin-xin-si-yu","The Sword and the Brocade","锦心似玉","Historical, Mystery, Romance, Drama",0,0,0,0,0,0,1,0,0,0,1,0,0,0,0,0,0,0,0,1,0,0,1,0,0,0,0,0,0,0,0,0
"/49953-my-love-enlighten-me","My Love, Enlighten Me","暖暖请多指教","Comedy, Romance, Life",0,0,0,1,0,0,0,0,0,0,0,0,0,1,0,0,0,0,0,0,0,0,1,0,0,0,0,0,0,0,0,0
"/21684-good-bye-my-princess","Good Bye, My Princess","东宫","Romance, Wuxia, Drama, Political",0,0,0,0,0,0,1,0,0,0,0,0,0,0,0,0,0,0,0,0,1,0,1,0,0,0,0,0,0,0,1,0
"/26760-the-legends","The Legends","招摇","Romance, Wuxia, Fantasy",0,0,0,0,0,0,0,0,1,0,0,0,0,0,0,0,0,0,0,0,0,0,1,0,0,0,0,0,0,0,1,0
"/29866-young-blood","Young Blood","大宋少年志","Mystery, Comedy, Wuxia, Fantasy",0,0,0,1,0,0,0,0,1,0,0,0,0,0,0,0,0,0,0,1,0,0,0,0,0,0,0,0,0,0,1,0
"/49431-ice-hockey-girl","My Unicorn Girl","穿盔甲的少女","Comedy, Romance, Youth, Sports",0,0,0,1,0,0,0,0,0,0,0,0,0,0,0,0,0,0,0,0,0,0,1,0,0,1,0,0,0,0,0,1
"/36109-ancient-detective","Ancient Detective","侠探简不知","Mystery, Comedy, Romance, Wuxia",0,0,0,1,0,0,0,0,0,0,0,0,0,0,0,0,0,0,0,1,0,0,1,0,0,0,0,0,0,0,1,0
"/30757-detective-l","Detective L","绅探","Thriller, Historical, Mystery, Comedy",0,0,0,1,0,0,0,0,0,0,1,0,0,0,0,0,0,0,0,1,0,0,0,0,0,0,0,1,0,0,0,0
"/53735-we-started-dating-from-marriage","Begin Again","从结婚开始恋爱","Business, Comedy, Romance",0,0,1,1,0,0,0,0,0,0,0,0,0,0,0,0,0,0,0,0,0,0,1,0,0,0,0,0,0,0,0,0
"/30561-gank-your-heart","Gank Your Heart","陪你到世界之巅","Romance, Youth, Drama, Sports",0,0,0,0,0,0,1,0,0,0,0,0,0,0,0,0,0,0,0,0,0,0,1,0,0,1,0,0,0,0,0,1
"/29548-s-c-i","S.C.I","S.C.I.谜案集","Thriller, Mystery, Psychological",0,0,0,0,0,0,0,0,0,0,0,0,0,0,0,0,0,0,0,1,0,1,0,0,0,0,0,1,0,0,0,0
"/19464-princess-agents","Princess Agents","特工皇妃楚乔传","Romance, Wuxia, Drama, Political",0,0,0,0,0,0,1,0,0,0,0,0,0,0,0,0,0,0,0,0,1,0,1,0,0,0,0,0,0,0,1,0
"/58585-together","With You","在一起","Drama, Medical",0,0,0,0,0,0,1,0,0,0,0,0,0,0,0,1,0,0,0,0,0,0,0,0,0,0,0,0,0,0,0,0
"/22170-fights-break-sphere","Fights Break Sphere","斗破苍穹","Romance, Wuxia, Fantasy",0,0,0,0,0,0,0,0,1,0,0,0,0,0,0,0,0,0,0,0,0,0,1,0,0,0,0,0,0,0,1,0
"/52317-intense-love","Intense Love","韫色过浓","Comedy, Romance, Life",0,0,0,1,0,0,0,0,0,0,0,0,0,1,0,0,0,0,0,0,0,0,1,0,0,0,0,0,0,0,0,0
"/79563-bu-hui-lian-ai-de-wo-men","Why Women Love","不会恋爱的我们","Business, Comedy, Romance",0,0,1,1,0,0,0,0,0,0,0,0,0,0,0,0,0,0,0,0,0,0,1,0,0,0,0,0,0,0,0,0
"/78279-horror-stories-of-tang-dynasty","Strange Tales of Tang Dynasty","唐朝诡事录","Thriller, Mystery, Horror, Wuxia",0,0,0,0,0,0,0,0,0,0,0,1,0,0,0,0,0,0,0,1,0,0,0,0,0,0,0,1,0,0,1,0
"/26226-the-eternal-love-2","The Eternal Love Season 2","双世宠妃II","Romance, Wuxia, Drama, Fantasy",0,0,0,0,0,0,1,0,1,0,0,0,0,0,0,0,0,0,0,0,0,0,1,0,0,0,0,0,0,0,1,0
"/35191-ping-pong","Ping Pong Life","荣耀乒乓","Youth, Drama, Sports",0,0,0,0,0,0,1,0,0,0,0,0,0,0,0,0,0,0,0,0,0,0,0,0,0,1,0,0,0,0,0,1
"/33795-wait-my-youth","Wait, My Youth","等等啊我的青春","Romance, Life, Youth",0,0,0,0,0,0,0,0,0,0,0,0,0,1,0,0,0,0,0,0,0,0,1,0,0,0,0,0,0,0,0,1
"/15663-ode-to-joy","Ode to Joy","欢乐颂","Romance, Life, Youth",0,0,0,0,0,0,0,0,0,0,0,0,0,1,0,0,0,0,0,0,0,0,1,0,0,0,0,0,0,0,0,1
"/73403-summer-again","Summer Again","薄荷之夏","Romance, Youth, Drama",0,0,0,0,0,0,1,0,0,0,0,0,0,0,0,0,0,0,0,0,0,0,1,0,0,0,0,0,0,0,0,1
"/61977-zhui-xu","My Heroic Husband","赘婿","Historical, Comedy, Romance, Drama",0,0,0,1,0,0,1,0,0,0,1,0,0,0,0,0,0,0,0,0,0,0,1,0,0,0,0,0,0,0,0,0
"/42107-the-young-lady-of-the-general-s-house","General's Lady","将军家的小娘子","Historical, Comedy, Romance, Political",0,0,0,1,0,0,0,0,0,0,1,0,0,0,0,0,0,0,0,0,1,0,1,0,0,0,0,0,0,0,0,0
"/52173-the-fires-of-cooking-hua-xiao-chu","Chef Hua","人间烟火花小厨","Food, Historical, Comedy, Romance",0,0,0,1,0,0,0,0,0,1,1,0,0,0,0,0,0,0,0,0,0,0,1,0,0,0,0,0,0,0,0,0
"/37221-nothing-but-thirty","Nothing But Thirty","三十而已","Business, Romance, Life, Drama",0,0,1,0,0,0,1,0,0,0,0,0,0,1,0,0,0,0,0,0,0,0,1,0,0,0,0,0,0,0,0,0
"/29686-sand-sea","Tomb of the Sea","沙海","Action, Adventure, Mystery, Supernatural",1,1,0,0,0,0,0,0,0,0,0,0,0,0,0,0,0,0,0,1,0,0,0,0,0,0,1,0,0,0,0,0
"/28695-the-lost-tomb-2","The Lost Tomb 2","盗墓笔记2","Action, Adventure, Mystery, Supernatural",1,1,0,0,0,0,0,0,0,0,0,0,0,0,0,0,0,0,0,1,0,0,0,0,0,0,1,0,0,0,0,0
"/62355-couple-of-mirrors","Couple of Mirrors","双镜","Thriller, Historical, Mystery, Drama",0,0,0,0,0,0,1,0,0,0,1,0,0,0,0,0,0,0,0,1,0,0,0,0,0,0,0,1,0,0,0,0
"/55281-the-rebel","The Rebel","叛逆者","Thriller, Historical, Crime, War",0,0,0,0,1,0,0,0,0,0,1,0,0,0,0,0,0,0,0,0,0,0,0,0,0,0,0,1,0,1,0,0
"/20582-ode-to-joy-2","Ode to Joy Season 2","欢乐颂2","Romance, Life, Youth",0,0,0,0,0,0,0,0,0,0,0,0,0,1,0,0,0,0,0,0,0,0,1,0,0,0,0,0,0,0,0,1
"/65847-ji-zhi-de-shang-ban-chang","Be Yourself","机智的上半场","Comedy, Romance, Life, Youth",0,0,0,1,0,0,0,0,0,0,0,0,0,1,0,0,0,0,0,0,0,0,1,0,0,0,0,0,0,0,0,1
"/24058-the-brightest-star-in-the-sky","The Brightest Star in the Sky","夜空中最闪亮的星","Music, Comedy, Romance, Life",0,0,0,1,0,0,0,0,0,0,0,0,0,1,0,0,0,0,1,0,0,0,1,0,0,0,0,0,0,0,0,0
"/55993-qing-qing-zi-jin","Qing Qing Zi Jin","青青子衿","Historical, Comedy, Romance, Youth",0,0,0,1,0,0,0,0,0,0,1,0,0,0,0,0,0,0,0,0,0,0,1,0,0,0,0,0,0,0,0,1
"/68431-wu-fa-lian-ai-de-li-zhi-pai","The Rational Life","理智派生活","Business, Romance, Drama",0,0,1,0,0,0,1,0,0,0,0,0,0,0,0,0,0,0,0,0,0,0,1,0,0,0,0,0,0,0,0,0
"/59017-luo-yang","Luoyang","风起洛阳","Thriller, Historical, Mystery",0,0,0,0,0,0,0,0,0,0,1,0,0,0,0,0,0,0,0,1,0,0,0,0,0,0,0,1,0,0,0,0
"/33645-a-little-thing-called-first-love","A Little Thing Called First Love","初恋那件小事","Comedy, Romance, Youth, Drama",0,0,0,1,0,0,1,0,0,0,0,0,0,0,0,0,0,0,0,0,0,0,1,0,0,0,0,0,0,0,0,1
"/20534-the-advisors-alliance","The Advisors Alliance","大军师司马懿之军师联盟","Historical, Romance, Political",0,0,0,0,0,0,0,0,0,0,1,0,0,0,0,0,0,0,0,0,1,0,1,0,0,0,0,0,0,0,0,0
"/27397-handsome-siblings","Handsome Siblings","绝代双骄","Comedy, Romance, Wuxia",0,0,0,1,0,0,0,0,0,0,0,0,0,0,0,0,0,0,0,0,0,0,1,0,0,0,0,0,0,0,1,0
"/34415-in-a-class-of-her-own","In a Class of Her Own","漂亮书生","Historical, Comedy, Romance, Youth",0,0,0,1,0,0,0,0,0,0,1,0,0,0,0,0,0,0,0,0,0,0,1,0,0,0,0,0,0,0,0,1
"/58697-miss-crow-with-mr-lizard","Miss Crow with Mr. Lizard","乌鸦小姐与蜥蜴先生","Business, Comedy, Romance, Fantasy",0,0,1,1,0,0,0,0,1,0,0,0,0,0,0,0,0,0,0,0,0,0,1,0,0,0,0,0,0,0,0,0
"/24131-the-first-half-of-my-life","The First Half of My Life","我的前半生","Romance, Life, Drama, Family",0,0,0,0,0,0,1,1,0,0,0,0,0,1,0,0,0,0,0,0,0,0,1,0,0,0,0,0,0,0,0,0
"/61923-once-we-get-married","Once We Get Married","只是结婚的关系","Comedy, Romance, Drama",0,0,0,1,0,0,1,0,0,0,0,0,0,0,0,0,0,0,0,0,0,0,1,0,0,0,0,0,0,0,0,0
